{
  "authority_id": "ruc-demo-authority",
  "cadence_sec": 300,
  "cap_policy_hash": "7f5f26a7f0c34a74adfafed302da9429b87690f90c29b0ce20dfe2abded41709",
  "cap_policy_sq": 3000000000,
  "circuit_id": "settlement-period-v5-k6",
  "commitment_version": 1,
  "currency": "EUR",
  "domain_sep": "waybill_policy_profile_v1",
  "fallback_semantics_version": "time-speed-max-rate-v5",
  "fixed_point_scale": 1,
  "jurisdiction_id": "ruc-demo",
  "max_dt_sec": 600,
  "max_fixes": 25,
  "max_zone_rate_cents_per_m": 5,
  "min_accepted_version": 7,
  "mode_vmax_sq": 1089,
  "monthly_reconciliation_rate_cents_per_m": 5,
  "overflow_policy": "reject-u96",
  "policy_profile_commitment": "21150643352738071342383300823421096337243216680434872497268001051641820180147",
  "profile_sha256": "31980b63958b5080718c52d6825350f5c00d34eb34fc0bfcc4007e27bbfef881",
  "profile_version": 7,
  "revoked_at": null,
  "rounding_mode": "exact-integer",
  "tariff_artifact_path": "ruc-demo-tariff-v7-d8.json",
  "tariff_root": 3198147557383068799725152331465711054989060357281836432776901098319050019306,
  "tariff_tree_depth": 8,
  "tariff_version": 7,
  "tier_vmax_mps": 33,
  "tier_vmax_sq": 1089,
  "valid_from": 1777593600,
  "valid_to": 1798761600,
  "verification_key_hash": "db7eb879bfe8cecb13e8539288b6fe43cc64c037c9032a8cb2943c42b81ba5b6",
  "verification_key_path": "../../zk/settlement_period_v5_k6/verification_key.json"
}
