{
  "authority_id": "ruc-demo-authority",
  "cadence_sec": 300,
  "cap_policy_hash": "7f5f26a7f0c34a74adfafed302da9429b87690f90c29b0ce20dfe2abded41709",
  "cap_policy_sq": 3000000000,
  "circuit_id": "settlement-period-v6-validity-bound-k25-d8",
  "commitment_version": 1,
  "currency": "EUR",
  "domain_sep": "waybill_policy_profile_v1",
  "fallback_semantics_version": "odometer-max-rate-v6",
  "fixed_point_scale": 1,
  "jurisdiction_id": "ruc-demo",
  "max_dt_sec": 600,
  "max_fixes": 25,
  "max_zone_rate_cents_per_m": 5,
  "min_accepted_version": 9,
  "mode_vmax_sq": 1089,
  "monthly_reconciliation_rate_cents_per_m": 5,
  "overflow_policy": "reject-u96",
  "policy_profile_commitment": "19189060107095078943373029755233485227080367977087589742745959455447551318479",
  "position_validity_rule": "origin-osnma-authenticated-v1",
  "profile_sha256": "62c1d705b55cf7d6371af47494053249d03848be578de59709fe38077010e77b",
  "profile_version": 9,
  "receiver_attestation_schema": "waybill.receiver.root-attestation/v5",
  "revoked_at": null,
  "rounding_mode": "exact-integer",
  "tariff_artifact_path": "ruc-demo-tariff-v9-d8.json",
  "tariff_root": 16029992397017151081834793174573413724970945817949566785628275521024864749618,
  "tariff_tree_depth": 8,
  "tariff_version": 9,
  "tier_vmax_mps": 33,
  "tier_vmax_sq": 1089,
  "valid_from": 1777593600,
  "valid_to": 1798761600,
  "verification_key_hash": "9715ac43bc809c94844b0cb8af120fb3b5342f6bcfa8adf27f9dcbce30add471",
  "verification_key_path": "../../zk/settlement_period_v6_k6/verification_key.json"
}
