{
  "domain_sep": "waybill_policy_profile_v1",
  "commitment_version": 1,
  "authority_id": "ruc-demo-authority",
  "jurisdiction_id": "ruc-demo-v6",
  "profile_version": 8,
  "valid_from": 1767225600,
  "valid_to": 1798761600,
  "revoked_at": null,
  "min_accepted_version": 8,
  "tariff_version": 8,
  "tariff_root": 9788217451448421423081770401639822481817084164623206346716908296474460758129,
  "tariff_tree_depth": 8,
  "max_fixes": 25,
  "max_zone_rate_cents_per_m": 5,
  "cadence_sec": 300,
  "max_dt_sec": 600,
  "tier_vmax_mps": 33,
  "tier_vmax_sq": 1089,
  "mode_vmax_sq": 1089,
  "cap_policy_sq": 3000000000,
  "cap_policy_hash": "eb9aa44ec8c5ca5e53ef5d4a7b8f42c09dd11a8ed2c93c547f45298332117395",
  "circuit_id": "settlement-period-v6-k6",
  "verification_key_hash": "f1e73b4e91fff595adff551b13466f15351b587231877f45e9d7b0d473b4569d",
  "currency": "CNY",
  "fixed_point_scale": 1,
  "rounding_mode": "exact-integer",
  "overflow_policy": "reject-u96",
  "monthly_reconciliation_rate_cents_per_m": 5,
  "fallback_semantics_version": "odometer-max-rate-v6",
  "verification_key_path": "../circuit/verification_key.json",
  "tariff_artifact_path": "tariff-v8-d8.json",
  "policy_profile_commitment": "13254117629810876594700960416131691042346931883958953200682963773285339498283",
  "profile_sha256": "a64067fa7a0d6fdbebbd6202b1a3fa31f275ab97db7d21bebe21d42b06082656"
}
